
<?xml version="1.0" encoding="ISO-8859-1"?>

<!ELEMENT price-list (coffee+)>

<!ELEMENT coffee (coffee-name, price)>

<!ELEMENT coffee-name (#PCDATA)>
<!ELEMENT price (#PCDATA)>